{
  "id": "",
  "title": "",
  "source": "",
  "text_type": "",
  "genre": "",
  "language_style": "",
  "length": {
    "words": null,
    "sentences": null,
    "scenes": null
  },
  "units": [],
  "foundation": "",
  "purpose": {
    "central_issue": "",
    "message": "",
    "moral_value": "",
    "faith_value": "",
    "lesson": "",
    "intended_effect": "",
    "additional": []
  }
}
